{
  "ecs_version": "1.0",
  "aggregation_id": "urn:example:aggregation:1",
  "contract": {
    "contract_id": "urn:example:aggregation-contract:1",
    "version": "1",
    "purpose": "example count",
    "inclusion_criteria": [
      "conditionally comparable or comparable under contract"
    ],
    "exclusion_criteria": [
      "withdrawn"
    ],
    "duplicate_policy": "one origin artifact counts once",
    "challenge_policy": "open challenges separately disclosed",
    "comparison_profile": "urn:example:comparison-contract:1"
  },
  "population": {
    "description": "two synthetic example artifacts",
    "date_range": "2026-10-12",
    "horizon": null
  },
  "included_artifacts": [
    "urn:example:artifact:a",
    "urn:example:artifact:b"
  ],
  "excluded": [],
  "result": {
    "count": 2
  },
  "boundary_statement": "This aggregate describes only the declared synthetic sample and does not establish scientific generality, causation, safety, or truth.",
  "created_at": "2026-10-12T18:00:00Z"
}
